{
  "schema": "mai-approval-v1",
  "scope": "lab",
  "granted_at": "2026-10-18T02:00:00Z",
  "valid_until": "2026-12-01T02:00:00Z",
  "granted_by": {
    "os_user": "owner",
    "host": "example-host"
  },
  "method": "owner-run mai-approve",
  "eula": {
    "accepted": true,
    "license": "NVIDIA Omniverse License",
    "subject": "owner",
    "consent_source": "owner typed at a terminal the owner operates"
  },
  "execution_mode": "unattended",
  "limits": {
    "allowed_paths": [
      "C:/lab/runs"
    ],
    "devices": [
      "GPU-0"
    ],
    "max_runs_per_unit": 1,
    "canary_retries": 1,
    "count_per": "experiment_unit_id"
  },
  "exclusions": [
    "paid_or_external_resource",
    "data_deletion",
    "kill_foreign_process",
    "system_or_security_setting",
    "external_send",
    "out_of_scope_experiment"
  ],
  "note": "week of 10/18 nightly runs",
  "sha256": "7c8aca60daf61eb70833088487f970d9d1106d18d1cf585ce3f0835e2322356b"
}
