{
  "schema": "mai-approve-approval-v1",
  "scope": "lab",
  "granted_at": "2026-10-18T02:00:00Z",
  "valid_until": "2026-10-25T02:00:00Z",
  "granted_by": {
    "os_user": "owner",
    "host": "example-host"
  },
  "method": "owner-run mai-approve",
  "eula": {
    "accepted": true,
    "license": "NVIDIA Omniverse License",
    "subject": "owner",
    "consent_source": "owner typed at a terminal the owner operates"
  },
  "execution_mode": "unattended",
  "limits": {
    "allowed_paths": [
      "/data/run"
    ],
    "max_runs_per_unit": 1,
    "count_per": "experiment_unit_id"
  },
  "exclusions": [
    "paid_or_external_resource",
    "data_deletion",
    "kill_foreign_process",
    "system_or_security_setting",
    "external_send",
    "out_of_scope_experiment"
  ],
  "sha256": "8ceec30410e19fe30960a5b6834e7dd3308dd8ed6fb9d50182e9b24490595eb8"
}
